Brand,Logo,Color,Function,Core Words,Usage
Rainbow,Non Logo,Black,Bluetooths Wireless,pubg mobile game controller,For Nintendo Switch Console
,,Splatoon,inalambrico,switch pro gaming controller,
,,Super Smash Bros,,joystick & game controller,
,,Xenoblade,,pc controller,
,,,,controle remoto video game controller,
,,,,switch ns pro controller,
,,,,copy replica switch pro controller,
,,,,replica switch controller,
,,,,pro controll nintend switch,
,,,,control pro nintend switch,
,,,,pro controller console gamepad,
,,,,n-switch pro controller,
,,,,pro controll nint switch,
,,,,control pro nitend switch,
,,,,mando nintend switch pro controller,
,,,,nintend switch wireless pro controller,
,,,,nintend switch lite controller pro,
,,,,nintend switch pro controller wireless gamepad,
,,,,pro controller for n-sl,
,,,,controller pro fps games,
,,,,control pro nitendo switch,
,,,,control inalambrico pro nintend,
,,,,mando pro controller ninitendo,
,,,,switch pro controller joystick,
,,,,pro controller für nintend,
,,,,mandos pro controller nintend switch,
,,,,for nintend switch pro game controller,
,,,,nintend joy-con pro controller,
,,,,2020 for switch pro controller gamepad wireless jo,
,,,,"ctr-003 3,7 v 1300mah li-ion pro controller switch",